cluster,average_rating,book_id,original_publication_year,pages,ratings_count,young-adult,fantasy,nonfiction,romance,adult,science-fiction,contemporary,mystery,classics,historical-fiction,keywords,cluster_name
0,3.999849315068493,4831.795890410959,1994.1780821917807,399.26438356164385,64469.34657534247,0.20136986301369864,0.6986301369863014,0.0013698630136986301,0.0136986301369863,0.026027397260273973,0.952054794520548,0.015068493150684932,0.08904109589041095,0.1232876712328767,0.038356164383561646,"hitchhiker, interstellar, science author, robot, jedi, solar, galactic, skywalker, alien planet, artificial",Galactic Odyssey: A Cosmic Journey Through the Stars and Beyond
1,3.9345993031358883,4824.976771196283,1987.0708478513357,398.8664343786295,63108.46573751452,0.13588850174216027,0.06155632984901278,0.0313588850174216,0.18234610917537747,0.11614401858304298,0.005807200929152149,0.0627177700348432,0.11033681765389082,0.1986062717770035,0.9570267131242741,"young unfold, tudor, viii, boleyn, mother ambitious, hitler, exquisitely, civil woman, auschwitz, philippa",The Tudor Legacy: A Dark and Ambitious Historical Odyssey
2,3.7490893169877406,4956.495621716287,2003.6094570928196,344.3782837127846,49420.22767075306,0.06304728546409807,0.0595446584938704,0.0017513134851138354,0.1786339754816112,0.1436077057793345,0.0035026269702276708,0.9439579684763573,0.11033274956217162,0.03677758318739054,0.06830122591943957,"palahniuk, bret, start fictional, away debut, beach family, picoult, jodi, auster, zadie, author daughter",Literary Fiction of Contemporary American Family Dynamics
3,3.954800693240901,4969.240901213171,2006.9202772963604,326.2357019064125,57275.76083188908,0.8388214904679376,0.038128249566724434,0.0,0.8648180242634316,0.02772963604852686,0.01733102253032929,0.8752166377816292,0.08665511265164645,0.01733102253032929,0.029462738301559793,"guy meet, kiss good, cammie, genovia, dessen, hide school, levithan, pretty secret, college forever, mia",Royal Romances of High School and Beyond
4,3.955093572009764,5299.824247355574,1998.7778681855166,386.2685109845403,35454.11391375102,0.04963384865744508,0.060211554109031735,0.010577705451586655,0.0024410089503661514,0.04149715215622457,0.04882017900732303,0.026037428803905614,0.9560618388934092,0.06753458096013018,0.05614320585842148,"inspector, millhone, bosch, lapd, poirot, grisly, lindsay, reacher, rapp, scarpetta",Detective Investigations of Dark Complexity and Moral Ambiguity
5,4.135653333333333,5626.24,2005.232,388.056,41936.968,0.005333333333333333,0.8533333333333334,0.0,0.968,0.584,0.008,0.037333333333333336,0.042666666666666665,0.005333333333333333,0.144,"woman immortal, brotherhood, anita, shapeshifter, vamp, fae, kresley, werewolf, crawfield, paranormal",Paranormal Romantic Fantasies of Eternal Allure
6,3.9850833333333333,5200.5142857142855,1989.9130952380951,347.6154761904762,34731.747619047615,0.013095238095238096,0.0035714285714285713,0.969047619047619,0.004761904761904762,0.02023809523809524,0.0011904761904761906,0.0035714285714285713,0.004761904761904762,0.04404761904761905,0.005952380952380952,"nonfiction, memoir man, cookbook, management, biography, autobiography, anecdote, ceo, thinker, finance",Business Insights of a Visionary Life
7,4.101689497716895,4605.021308980213,1998.642313546423,340.1339421613394,94902.8203957382,0.9208523592085236,0.9117199391171994,0.0106544901065449,0.0091324200913242,0.0106544901065449,0.0776255707762557,0.0136986301369863,0.1171993911719939,0.0928462709284627,0.0532724505327245,"thunderclan, redwall, discworld, morpork, pratchett, lemony, percy, wizarde, hogwart, ankh",Discworld Chronicles of Fantasy and Adventure in a Shared World
8,4.049884297520661,5148.462809917355,1950.7669421487603,319.3090909090909,37158.277685950416,0.01652892561983471,0.009917355371900827,0.9355371900826446,0.0049586776859504135,0.02809917355371901,0.0,0.001652892561983471,0.003305785123966942,0.12396694214876033,0.008264462809917356,"spirituality, believer, growth, inspiring, candid, nietzsche, jesus, autobiography, help spiritual, thinker",Inspirational Spiritual Journeys of Self-Discovery and Faith
9,4.0561850649350655,4525.457792207792,2009.0616883116884,378.0779220779221,72135.35227272728,0.9415584415584416,0.9545454545454546,0.0,0.974025974025974,0.0,0.125,0.006493506493506494,0.06655844155844155,0.0,0.05032467532467533,"zoey, stefan, faery, shadowhunter, stackhouse, werewolf, yuki, lissa, moroi, dragomir",Paranormal Love Bites of Immortal Youth
10,3.9855744125326367,4389.848563968669,1859.7114882506528,349.5496083550914,79669.25718015665,0.0639686684073107,0.09530026109660575,0.050913838120104436,0.11096605744125326,0.006527415143603133,0.037859007832898174,0.031331592689295036,0.08093994778067885,0.9725848563968669,0.2310704960835509,"commentary, hemingway, great literature, moral novel, poirot, explanatory, irony, novel portrait, chronology, hypocrisy",A Study of Hypocrisy and Moral Complexity through Classical Narratives
11,4.14448742746615,5204.566731141199,1982.4661508704062,159.9787234042553,48850.40425531915,0.10444874274661509,0.07736943907156674,0.017408123791102514,0.025145067698259187,0.015473887814313346,0.0038684719535783366,0.0019342359767891683,0.005802707930367505,0.1702127659574468,0.0019342359767891683,"seuss, rebrand, hobbe, batman, heffley, aloud, seusss, caldecott, wimpy, superman",The Darkly Humorous World of Superheroes and Childhood Classics
12,4.005266272189349,5290.128205128205,2010.0927021696252,355.603550295858,54150.136094674555,0.0039447731755424065,0.005917159763313609,0.0,0.9250493096646942,0.8284023668639053,0.0039447731755424065,0.9408284023668639,0.05128205128205128,0.0039447731755424065,0.02564102564102564,"steamy, hockey, cocky, turn heal, paparazzi, playboy, standalone, want suppose, montgomery, chick",Flawless Hockey Heroes of the Spotlight
13,3.9786799999999998,5615.32,2001.836,371.192,32460.868,0.016,0.072,0.0,0.956,0.02,0.028,0.26,0.884,0.032,0.132,"trenton, morelli, dallas, mazur, vinnie, bail, peabody, evanovich, lula, roarke",Trenton's Family Ties of Love and Justice
14,4.117772585669782,4706.63707165109,1982.0420560747664,473.55607476635515,49381.86448598131,0.018691588785046728,0.9797507788161994,0.006230529595015576,0.04205607476635514,0.028037383177570093,0.018691588785046728,0.006230529595015576,0.05763239875389408,0.056074766355140186,0.09968847352024922,"elf, torak, drizzt, druid, feist, sandman, mage, kahlan, lannister, belgarath",High Fantasy Realm of Ancient Magic and Legendary Heroes
